Padrão,Frase,Nome da Música,Nome do Artista,Gênero Musical,Letra da Música,Categoria,Sentimento
substantivo,ninfeta é o jeito,Cara Metade,Bonde da Stronda,Hip Hop; Romântico; Rap,"Não sei quanto tempo faz mas se desfaz a era sagaz. Essa marra de pegador mar playsson tô deixando para. Trás. Quando você encontra aquela menina que te faz sorrir. Menina fascinante que por ela eu deixo de existir. . Meu coraçao agora é dela, meu amor te foca. Adoro seu jeito perfeito quando me olha e me provoca. Seus lábios perfeitos que eu chamo de minha boca de. Mel. Quando estamos juntos quero levar ela pro céu. . Pro céu, pro mar, na praia, ao luar tudo que realmente. Uma mulher precisa pra poder amar. Me declaro por você e sei que você é a minha amada. Te entrego rosas e um cartão porque eu te quero. Apaixonada. . Apaixonado eu já estou e você também, tranquilo ao. Pensar. Que encontrei o meu 'alguém', alguém que faltava ou. Que eu nunca sonhava, talvez ignorava e nunca me ligava. . Mas é assim que a vida faz. Varias surpresas acontecem e agora eu te amo demais. Te amo pra sempre, meu chão, minha vida, minha fada. Se nada é pra sempre quero você pra mim imortalizada. . Tento expressar em palavras o que eu faço pra te. Merecer. Mas te digo garota que a palavra mais bela ainda é pouco. Pra você. Pra você, por você, com você, nunca vou me esquecer. . O que será que você fez pra me deixar louco desse. Jeito ?. Apague a luz do seu quarto, só nos dois, com todo. Respeito. Que meu amor é verdadeiro disso eu tenho certeza. É tão doce, flamejante, insaciavel e aquele toque de. Pureza. . Mas meu amor te prometo que nada deixarei faltar. Se algo acontecer, por favor é só me falar. Porque quando a gente ama esquece de tudo. Só ve a pessoa amada no claro ou no escuro. . Com você eu posso ficar até surdo mudo e cego. Preciso apenas te tocar que aí eu sossego. Mulher da minha vida, amor sem limites. Ficarei contigo até envelhecer, sem palpites. . Quando o amor te toca, vale tudo pra você viver. Quando o amor te foca, vale tudo pra não te perder. Te amo sem restrição, tipo amor e amizade. Nos declaramos pra nós mesmos, nosso amor é raridade. . Me lembro do dia que eu negava que você era. Minha musa inspiradora todo mundo falava 'é ela'. Tentava me esquivar da situação e do meu estado. Se alguém soubesse ia ver que eu estava apaixonado. . O tempo passou, tudo mudou, o meu amor só aumentou, e hoje eu sou. Um cara que vive muito bem a sua vida, apaixonado por ela, namorada és minha trilha.. . Trilha da minha vida e do meu sentimento. Graças a deus vivo contigo, acabei com aquele. Tormento. Tormento de solteiro ignorava o que eu sentia. Nosso amor é muito forte minha melhor compania. . É inevitável um grande amor nunca é ignorado. Esse é, o meu estado realmente apaixonado. . E pra você só tenho ótimas vibrações. Calcule muito bem o valor de suas decisões. Vida minha, pra sempre será o amor meu,. Essa canção é tipo assim, tipo você e eu.. . Quando ouvir essa música lembre sempre de mim. Porque fiz pra você deusa do sorriso de marfim. Somos um pouco diferentes mas até daqui as rimas saem. É realmente veridico que os opostos se atraem. . Opostos no começo, porque no meio no final. Somos perfeitos um para um outro um amor totalmente. Surreal. Surreal, anormal, fatal e coisa e tal. . Quero sempre que saiba que por você eu dou a volta no. Planeta. Você é a coisa mais perfeita que me aconteceu minha. Ninfeta. Ninfeta é o jeito que eu te chamo assim. Carinhosamente. Porque nome de mulher é apenas o seu fixado em minha. Mente. Como eu falei no refrão quando amor te toca. Não há nada mais que faça que ele mude a sua volta. . Então paro por aqui e deixo claro minha mensagem. Te amo como nunca amei ninguém minha cara metade. . Quando o amor te toca, vale tudo pra você viver. Quando o amor te foca, vale tudo pra não te perder. Te amo sem restrição, tipo amor e amizade. Nos declaramos pra nós mesmos, nosso amor é raridade",Caráter,Negativo
sujeitoadjetivo,"adolescente, inconsequente, jovem",Bem Loko,Rashid,Hip Hop; Rap,"Meus mano querem ficar bem louco. Sair da merda e ficar bem louco. Ganhar um troco e ficar bem louco. Mudar de vida e ficar bem, vida e ficar bem. . Bebo sim, mas não é vício, não é bem assim. Só uma dose antes de dormir e uh. Hennessy, tiver goteira então pinga ni mim. Cerveja é fraca, desce aí o gin, uh. . Yeah, yeah. Por bares e bares andei, minha família trombei lá. Meu tio que perdeu o emprego. no bar gastou a rescisão inteira. Meus primo no mesmo caminho. e a casa sem eira nem beira. Dirigindo e bebendo, domingo a domingo. dane-se a segunda-feira. Mas vamos brindar, o importante. é dar asa pro Johnnie Walker. Mas nenhum deles keep walking. mano, fala pu'cê, o diabo é o pior stalker. Minha boca na boca do copo. é o beijo perfeito, língua e gelo. Um filme noir, o balcão do bar. já tem a forma do meu cotovelo. Bebo quando o problema vem. bebo quando o problema vai. Bebo quando tenho de cem. bebo quando o dim dim não cai. Fi, eu num bebo demais, discordo, meu plano é límpido. Só tô repondo já que dizem que o corpo humano. é 70 líquido. E até o lucro é líquido. Lúpulo, malte, uma lupa e a breja. é o que deixa meu dia mais vívido. Querem que eu mate minha sede com água?. Esse negócio insípido. Vê se larga a mão de ser ridículo, estúpido. E me vê outra dose. que o pai ainda tá completamente lúcido (Burp!). . Bebo sim, mas não é vício, não é bem assim. Só uma dose antes de dormir e uh. Hennessy, tiver goteira então pinga ni mim. Cerveja é fraca, desce aí o gin, uh. . A dose reúne os parça, isso acontece em vários lugares. Quebrada tem poucas praças. parques e várias igrejas e bares. Aquele barril tem preço baixo. mas pode deixar um pouco alto. Camisa aberta, peito vermelho. um corpo deitado bem no asfalto. É tudo na social mas o efeito pode ser antissocial. Pra muitos um copo na mão é crucial. pra se sentir mais inserido no espacial. Pretos cortando cana, cara pálida faz cifrão. E os pretos indo pra cana, bebendo cana. eles chama de abolição. O status é muito hype, hype todos querem ter. Status: offline, depois de uma noite quando dá P. T. Tá na Tv, propaganda, garrafas brilham, sai faísca. A vida não é mole, tamo dando gole. celebrando mas sem se tornar uma isca. Dando milho na rua. botando na conta do drink é abominável. Adolescente, inconsequente, jovem chapado e vulnerável. Remédio de uma vida miserável. pra família se torna insuportável. Pra muitos o amor é ausente. por isso que o bar é tão amável. . Bebo sim, mas não é vício, não é bem assim. Só uma dose antes de dormir e uh. Hennessy, tiver goteira então pinga ni mim. Cerveja é fraca, desce aí o gin, uh. . Quando é dia de festa, fei, junta os loko e faz o ratei. Uísque e gelo de coco tem. e a mina de ontem quer o replay. Hoje é estouro, só tey! tey! tey!. Tiramo a roupa e eu me deitei, tava bem loko e capotei. Pensando bem eu me sabotei. Quando é dia de festa, fei, junta os loko e faz o ratei. Uísque e gelo de coco tem. e a mina de ontem quer o replay. Hoje é estouro, só tey! tey! tey!. Tiramo a roupa e eu me deitei, tava bem loko e capotei. Pensando bem eu me sabotei. Uhm?",Papel Social,Negativo
sujeitoadjetivo,"novinha, cheia",A Luz (Tapa na Cara Mix),MV Bill,Rap; Hip Hop,"Começando agora mais uma sessão. A cabeça vai a África, os pés fica no chão. Afro descendência, a nossa essência. Pretidão que tá na pele ilumina a consciência. O efeito da ação (firmou) liberdade pro negrão. Tá na expressão, no modo de se vestir. Energia ancestral também vai te possuir. . Fui possuída, preta assumida. Vivência na favela é minha lição de vida. Cabeça tá erguida, olhando para frente. Espero poder contar com as Preta inteligente. Que fecham juntas pra somar. Acredito que viemos ao mundo para brilhar. Não pra ser mandada, nem pisoteada. Vista como nada, maltratada. Novinha, cheia de filho e acabada. Eu to ligada, não é fácil chegar. Tem sangue ruim no caminho pra atrapalhar. Querendo abafar a voz preta feminina. Versos combativos são o centro da minha rima. (mina) Tamo junto até o final. Auto valorização vai ser o diferencial. (racial) Evidente nos tambores da Bahia. Pretitude tá na cara, presente no dia a dia. . Quem tá em baixo vai querer subir. Cada um cuidando de si. Com foco no objetivo onde você quer chegar. A luz que vai guiar. Quem vai vir, pra querer subir. Cada um cuidando de si. Com foco no objetivo onde você quer chegar. A luz que vai guiar. . Sem conhecimento a herança africana não avança. Não quero vingança, só o nosso por direito. Tem gente aguardando na fila daquele jeito. (renascido do pó) Sobrevivente da poeira. Se defende da pernada como bom capoeira. Você que é nagô e honra sua cor. Vai entender quando escutar o barulho do tambor. É diferente, conectado com a minha gente. Emergente, preto suficiente. Inocente, perde a vida e deixa a dor. A chapa é quente nas ruas de Salvador. . Várias comunidades dominadas pelo Crack. Matam mais Civis do que na guerra do Iraque. Num país contraditório como o nosso. Onde o Preto vale menos, a nação precisa entender. Que a força pra mudar, tá em cada um de nós. Sem mudar o objetivo, se quiser viver. Vou dizer, ao som do berimbau. A distribuição de oportunidade é desigual. Na moral, boto fé na minha raça. Mesmo que em alguns isso desperte uma ameaça. Contra o mau olhado carrego meu Patuá (sarava). Só me ligo na luz que vai guiar. . Quem tá em baixo vai querer subir. Cada um cuidando de si. Com foco no objetivo onde você quer chegar. A luz que vai guiar. Quem vai vir, pra querer subir. Cada um cuidando de si. Com foco no objetivo onde você quer chegar. A luz que vai guiar. . Vem que a gente tem capacidade. Mesmo na invisibilidade. Presente em cada cidade. Sem maldade (prosperidade pra nós). Liberdade (de verdade na voz). Sou Kamilla Cdd (boto o morro pra descer). Prego a superação (chega de submissão). Chapa Preta, minha família, meu comando. Vambora que tem gente nos olhando (se ligou?). . Quem tá em baixo vai querer subir. Cada um cuidando de si. Com foco no objetivo onde você quer chegar. A luz que vai guiar. Quem vai vir, pra querer subir. Cada um cuidando de si. Com foco no objetivo onde você quer chegar. A luz que vai guiar",Aparência,Negativo
sujeitoadjetivo,criança morta,A Favela Chora,Realidade Cruel,Rap; Hip Hop,"Se segura na cadeira ""REALIDADE"" tá de volta. Empunho a bandeira honrosamente traz a glória. Pra quem anciosamente aguardou por 4 anos. Foram longas caminhadas mas por Deus aqui estamos. E juntos lado-a-lado mesmo na dificuldade. E quantas vezes atormentados pela sombra da maldade. Em verdade um dia tive o coração no crime. A mente acelerada pra explodir a cena é triste. Só eu sei o que passei várias noites,madrugadas. Sentindo o orvalho na pele ,a mão gelada. Por dentro só rancor amargura infinita. um DAVI sem ter amor derrotando um GOLÍAS por dia. Almejei também quem não gostaria. Vários carros na garagem ,mansão com piscina. É assim, quantos que não vi igual a mim. Que sonharam muito mais e anteciparam o fim. Chorei pelas almas daqueles que partiram. De forma inocente deixando somente pros filhos. O sobrenome e a lembrança de um pai. Que nos corres tenta a sorte. nem sequer vai voltar mais. Bicho feio,o céu escureceu e caiu raios. O irmão ali ligou óó.... . ""Deus deve estar zangado,. uma par de fita besta uma par de cara hipócrita. que olha pra você,que murmura e que roda. pique meio julgando como se fosse o Mestre. maquinando o que cê tem,o que cê ganha,o que cê deve. o carro que você dirije o tênis que cê calça. se o celular tem chipe pra atacar sua calma. olha pra você veja só cê num intende. que hoje tá pior,bem pior que antigamente. tem mina indo pra cama pra depois ir fumar cráck. com corpo de criança e 11 na identidade. moleque nos cortiço de bermuda aveludada. de toca na cabeça e na cinta umas quadradas..."". . Irmão eu tô ligado o bagulho tá mó zica. Ocê num tá errado leio as santas palavras da Bíblia. Todos os dias olho pro céu e ainda penso. Meus filhos vão crescer nesse mar de sofrimento. É polícia que extermina,corrupção ,politica. Cifras que corrompem a balança da justiça. . ""Ei podridão infelizmente eu sei bem,o. Diabo te da mão pra depois te tomar o que cê tem"". . E veja bem não é conversa nem paródia. Eu que já tive na mira de tiro da ROTA. Posso te falar que hoje não me encanta tanto. Os BULLOVA ,os cordão de ouro branco ,. Os pião de criminoso, de whiske e energético. Glóck entupetada no bolso, outro incrédulo.. . [Refrão]. Infelizmente veja só com é que é as favela chora. Se tem fuzil sobre os tripé e tem criança morta. Eu sei que é foda, o inimigo não tem piedade. Mata na crocodilagem com ódio e crueldade. E na verdade tinha que ser diferente. O RAP veio pra denunciar ,bater de frente. Não importa se eles vão falar que nós é apologia. Ainda tem sangue voando nos pára-brisa.... . Dá licença aqui da palavra da licença,. A mina que não tem meias palavras da licença. Eu não sou daquelas que cê vê de silicone. De bunda empinada dentro das LAND ROVERS. De cheque especial de brinco e gargantilha. Com jóias de cristal e contas na SUIÇA. Eu não sou, sou apenas mais uma que vem do crime. Com sede de justiça e na veia correndo apetite. Disposição prus BANG de mil grau. Envolvida de coração e não pelo vil metal. Vi mortes ,parceiros que jogaram a vida pro alto. E acabaram com os crânios furados no asfalto. Ostentação que conduz de forma mágica. Morrer outro irmão sem Jesus de forma trágica. Louca,vida louca ,vida bela ,bela vida. O que um dia foi SODOMA hoje é periferia. Pelo amor,aos 4 cantos é orgia e luxúria. Só terror e daqui de baixo ainda vejo a lua. Da favela como lampada em meio a madrugada. O jornal que cobre a criança em cima da calçada. É o mesmo que infelizmente vem e traz noticia.... . ""- Show na praça da SÉ termina em selvageria"". Presta atenção vagabundo que o sistema quer te ver. Dentro da cova ou então quer te ver de algema. É muita trêtá mais cê num intendi o propósito. Que no final da cena não tem jogador de PÓLO. Nem sequer socialigth ,executivo ou herdeiro. Caminhando pela paz em pról dos favelado ou dos preto. São reféns do capital acumulado. É camera 24 horas ,carro blindado. Aqui no inferno héliporto e táxi aéreo. Pra não ver o próprio sangue tingindo o concreto. Pelo moleque de oitão que sem dó puxa o gatilho. Na reta do seu coração,na frente do seu filho. Diz pra mim se não é melhor TÊNIS em. ROLLAND GARROS com dinheiro da obra super faturada. Pra depois aparecer com advogado rindo no jornal. Conduzido a cárceragem da POLÌCIA FEDERAL. Tomar café e sair fora com HÁBIAS CORPUS concedido. E depois presentear com carro e moto o juíz corrompido. É mesmo incrível e eu nem sei como é que é. Apenas o que digo é que estamos ai de pé. Cada vez mais CRUEL com fúria no raciocínio.... ""- Se segura na cadeira que aqui o abalo sísmico"". Tá de volta, tá no ar e veio pra devastar.... ""- Mais tenebroso que rajada de AK"". Não importa se eles vão falar que o RAP é apologia. Ainda tem sangue voando nos pára-brisa.... . [Refrão 2x]. Infelizmente veja só com é que é as favela chora. Se tem fuzil sobre os tripé e tem criança morta. Eu sei que é foda, o inimigo não tem piedade. Mata na crocodilagem com ódio e crueldade. E na verdade tinha que ser diferente. O RAP veio pra denunciar ,bater de frente. Não importa se eles vão falar que nós é apologia. Ainda tem sangue voando nos pára-brisa...",Neutro,Negativo
sujeitoadjetivo,criança triste,Jardins de Aço,Realidade Cruel,Rap; Hip Hop,"Ei irmão, você pode me falar onde reside a paz. Eu procurei de mais, ""mais"" que agora foi em vão. Num encontrei nem se quer, na escada interminável. Do sub-consciente que te leva ao imaginário. Apenas vi só olhares, lágrimas, semblantes de rancor. Pra quem sonhou com ouro, diamantes. Filho! Minha riqueza não tá no vil metal. Minha base é minha família meu alicerce matrimônial. Hey! Palavras lindas, belas, porém. Requer cautela de um homem como eu. E olha só, oh! Cadê o seu mágico de oz. Sua fantástica fábrica de chocolate irmão. Olha ao seu redor e veja apodrecendo. Nas cadeias, tristão, igual o mestre na última ceia. Somos simplesmente um bando de cegos. Teleguiados freqüentemente ao inferno. Mas você não chora, não sofre em silêncio. Quando vê um sangue seu a minutos do próprio enterro. Não é possível! As flores perderam o perfume. É mesmo incrível como as tracas, as 9, as uzi. Trai e atrai como um ímã os meus e os seu irmãos. O sonho de consumo, ilusão. Você pode me dizer de uma maneira confortável, simples. Ou por favor com uma verdade eficaz. E se comparado ao olhar de uma criança triste. Será que neste mundo ainda existe a paz. Só espero que não seja tarde de mais (tarde demais). . Ei irmão olha pra mim porque cansei de errar. Cansei de sofrer, cansei de chorar. Cansei de fazer tudo que me levasse ao inferno. Das cadeias, velórios, necrotérios. E a neblina do ódio e rancor. Dos guerreiros mais nobres. E as lágrimas que ainda escorrem. Da mãe no leito de morte. Do filho que um dia sonhou por aqui. Dar luxo e jóias ao invés de jasmim. Nunca mais vai faze-la sorrir. Infelizmente aqui é assim. . Cadê a paz que tanto procurei. As flores no jardim de aço que tanto reguei. Germinaram ao contrário, so vejo rancor. Nos corações ódio e dor (2x). . Eu tava humildemente cabisbaixo e pensativo. Poh! Tá tudo errado oh, irmão que que isso. Vi, presenciei até mesmo livramentos. Não acreditei quando recordei enterros. Em letras, poemas, manuscritos, saudades. Sou apenas grão de areia nesses parques de Bin Laden. Eu vi a letra jota na sigla PJLI. Quantos de nós que morreram por aqui. Enterrados em caixões lacrados, sem amigos. Com corpos em mares de sangue, crivados de tiros. E alguém no meu ouvido vem e dá um salve. . - Isso memo bunitão, boa tarde pra nois então... Tamo ai daquele jeito, a mil por hora, oh. Certo pelo certo, sem preguiça, nem demora. São Paulo é tudo nosso, vai vendo, é isso memo. Somos mais de trinta mil, aqui é o primeiro. . Irmão, das suas palavras faço a minha de igual. Agradeço o respeito, mas para um momento sem Fal. Nem - canto rap, num sou crime. Ao contrário para muitos sou exemplo, sou vitrine. Embora monstro receioso, de carne, pele e osso. Que faz do veículo de comunicação profissão perigo. E para muitos tô montado só porque. Ando nos carro com os cordão que faz brilhar. Num colo em função, meus amigos são escassos. Deus tá do meu lado, ele não deixa faltar. Força e hombridade, respeito e lealdade. Amor no coração e muita dignidade. É isso! Vamo que vamo porque o ritmo é febril. Sem idolatrar ninguém, nem tiro de fuzil. Sem derramamento de sangue no pré-sumário. Dá licença que a mente em bang entra em colapso. Para, por favor me diz, se até hoje sua mãe é infeliz. E você não pode nem se quer caminhar. Cem metros em linha reta sem ter que parar. O barato é locão sangue bom, então me fala cadê a paz. Que eu também quero encontra-la. . Cadê a paz que tanto procurei. As flores no jardim de aço que tanto reguei. Germinaram ao contrário, só vejo rancor. Nos corações ódio e dor (2x). . Sonhar com os bagulho da hora, quem que não sonha. Casaco de pele, moto nervosa, as roupas. Das grifes mais locas, os avanços tecnológicos. Sacar de blackberry, ostentar só com relógios suiço. Inconformismo só pras herdeiras. Ter que dividir comigo, primeira classe de empresa. aérea. Sentido europa, acima do oceano. Fala que me espera, abre os braços tô voltando. Tô chegando e boas novas eu vou trazer. O mundo que eles gostam não foi feito pra você, nem. pra mim. Então de furador, ces vai e saca. Entra que nem louco rasgando agências bancárias. E gasta tudo em um mês e volta a zero. Ou então perde tudo na masmorra do inferno. Duelo do homem vs moeda é o que faz. Você para e reflete, cadê a paz. . Cadê a paz que tanto procurei. As flores no jardim de aço que tanto reguei. Germinaram ao contrário, só vejo rancor. Nos corações ódio e dor (2x). . Cadê a paz.... Nos corações. Somente ódio e dor. Cadê a paz...",Emoção,Negativo
sujeitoadjetivo,criança suicida,O Bonde,Realidade Cruel,Rap; Hip Hop,"-O bonde vem descendo a ladeira e não é ficção. então trema, ele vem pra abalar o sistema,. bate de frente sem medo...Biz. . Nos 4 cantos do país ou pelo mundo é a mesma fita. REALIDADE CRUEL sem hipocrisia ,ai tru?. Cê num queria BIN LADEN que representassem. O sofrimento eo sentimento de humanos privados no. cárceres. Aqui é nós,depois de nós,é nós de novo!. Batendo de frente com com as bactéria com os bonde do. morro. Mesmo acusado de fazer apologia. O programa da TV não vai mudar minha ideologia. Vem...palavras são palavras não esqueça. O ato de falsidade pra nós é sentença de morte. Felizmente pru injusto a sorte nem sempre bate na. porta. Quando bate é GLOCK cuspindo,pilantra sangrando ou. subindo. ""- Foi nessa heróI GAMBÉ a paisano...triste, triste,. triste. Não sei se vai mudar os fura lata querem vomitar"". moleque chora a ausência do pai em VENCESLAU. Implora pra mãe uma bola no natal de capotão. Pra ser jogador e não ladrão. Quem sabe até talvez professor de educação. Física ,se chegar até 22 de vida,. Se não entrar na linha de tiro da polícia. Periferia amarguradamente sangra fél. Crânios que projetam bombas que caem do céu. . [Refrão]. -O bonde vem descendo a ladeira e não é ficção. então trema, ele vem pra abalar o sistema,. bate de frente sem medo...Biz. . Eu tava ali bandido escrevo ou não escrevo. Penso ou repenso será que o exemplo deve ser. Letras metódicas sem nexo,. Com frases remotas pra fazer sucesso. Impossível desde o inicio foi aquilo. Nas rua ou nas favelas ,no gueto ou nos presídios. Ser leal a proposta do RAP NACIONAL contestação. Á descriminação racial,social e tal denuncia e. informação. Por mais que cêis fala que nós é porta voz de ladrão,. Num interessa ,sai da reta eu tô com pressa. De BRASILIA a PORTO ALEGRE. O tsunami tá pronto pra guerra. Morte aos políticos corruptos do plenário. Com bala na cabeça e os dedos da mão decepados. Constantemente se formam correntes de maléficos. Porcos ,poderosos indolentes que exploram. Os sonhos dos humildes que habitam os morros. Velas acesas pela alma do filho mais novo. Que sem socorro o crime vem pra resgatar. Pra depois entrar no tráfico e atirar em farda militar. E pra somar o preço é muito alto,às vezes. Custa mais que seus miólos espalhados no asfalto. Então perceba que infelizmente é muita trêtá. O BONDE vem descendo a ladeira. . [Refrão]. ""- O bonde vem descendo a ladeira e não é ficção. então trema, ele vem pra abalar o sistema,. bate de frente sem medo...Biz"". . Jogos panamericanos, visita do PAPA. Chicote estralando violência que se espalha. Repara o mundo que nós vive é caótico. Pedir PAZ aqui até parece um tópico. Enquanto tem celular de 1 milhão. Criança suicida no AFEGANISTÃO. Vi de perto várias mina ripando no CRÁCK. Com filho na barriga bem louca nas boate. Ou então entrando em cana na revista da visita. Com chip mukiado e várias gramas de farinha. Também queria viajar pelo mundo. De 1ª classe passeios noturnos. FRANÇA ,ITÁLIA ilhas do PACÍFICO. Faculdade em HAWARD ao invés de narrar homicídio. De algum mano que sem dó foi fuzilado. Pelo grupo de extermínio em SÃO PAULO depois do. atentado. Mês de maio 06 vagabundo o calendário da PM tá de luto. Aqui na arena lança chama ,380 e os gladiador enfiam. bala de .40. O barato é louco o crime não é brincadeira. Infelizmente é armadilha do sistema. Eu tô na cena e sempre serei verdadeira. O BONDE vem descendo a ladeira.... . [Refrão 4x]. ""- O bonde vem descendo a ladeira e não é ficção. então trema, ele vem pra abalar o sistema,. bate de frente sem medo...""",Emoção,Negativo
