Padrão,Frase,Nome da Música,Nome do Artista,Gênero Musical,Letra da Música,Categoria,Sentimento
sujeitoadjetivo,mocinho franzino,Desespero da Piedade,Vinicius de Moraes,bossa-nova,"Meu senhor, tende piedade dos que andam de bonde. E sonham no longo percurso com automóveis, apartamentos.... Mas tende piedade também dos que andam de automóvel. Quando enfrentam a cidade movediça de sonâmbulos, na direção.. Tende piedade das pequenas famílias suburbanas. E em particular dos adolescentes que se embebedam de domingos. Mas tende mais piedade ainda de dois elegantes que passam. E sem saber inventam a doutrina do pão e da guilhotina.. Tende muita piedade do mocinho franzino, três cruzes, poeta. Que só tem de seu as costeletas e a namorada pequenina. Mas tende mais piedade ainda do impávido forte colosso do esporte. E que se encaminha lutando, remando, nadando para a morte.. Tende imensa piedade dos músicos dos cafés e casas de chá. Que são virtuoses da própria tristeza e solidão. Mas tende piedade também dos que buscam silêncio. E súbito se abate sobre eles uma ária da Tosca.. Não esqueçais também em vossa piedade os pobres que enriqueceram. E para quem o suicídio ainda é a mais doce solução. Mas tende realmente piedade dos ricos que empobreceram. E tornam-se heróicos e à santa pobreza dão um ar de grandeza.. Tende infinita piedade dos vendedores de passarinhos. Que em suas alminhas claras deixam a lágrima e a incompreensão. E tende piedade também, menor embora, dos vendedores de balcão. Que amam as freguesas e saem de noite, quem sabe onde vão.... Tende piedade dos barbeiros em geral, e dos cabeleireiros. Que se efeminam por profissão mas que são humildes nas suas carícias Mas tende mais piedade ainda dos que cortam o cabelo:. Que espera, que angústia, que indigno, meu Deus!. Tende piedade dos sapateiros e caixeiros de sapataria. Que lembram madalenas arrependidas pedindo piedade pelos sapatos. Mas lembrai-vos também dos que se calçam de novo. Nada pior que um sapato apertado, Senhor Deus.. Tende piedade dos homens úteis como os dentistas. Que sofrem de utilidade e vivem para fazer sofrer. Mas tende mais piedade dos veterinários e práticos de farmácia. Que muito eles gostariam de ser médicos, Senhor.. Tende piedade dos homens públicos e em particular dos políticos. Pela sua fala fácil, olhar brilhante e segurança dos gestos de mão. Mas tende mais piedade ainda dos seus criados, próximos e parentes. Fazei, Senhor, com que deles não saiam políticos também.. E no longo capítulo das mulheres, Senhor, tende píedade das mulheres Castigai minha alma, mas tende piedade das mulheres. Enlouquecei meu espírito, mas tende piedade das mulheres. Ulcerai minha carne, mas tende piedade das mulheres!. Tende piedade da moça feia que serve na vida. De casa, comida e roupa lavada da moça bonita. Mas tende mais piedade ainda da moça bonita. Que o homem molesta – que o homem não presta, não presta, meu Deus!. Tende piedade das moças pequenas das ruas transversais. Que de apoio na vida só têm Santa Janela da Consolação. E sonham exaltadas nos quartos humildes. Os olhos perdidos e o seio na mão.. Tende piedade da mulher no primeiro coito. Onde se cria a primeira alegria da Criação. E onde se consuma a tragédia dos anjos. E onde a morte encontra a vida em desintegração.. Tende piedade da mulher no instante do parto. Onde ela é como a água explodindo em convulsão. Onde ela é como a terra vomitando cólera. Onde ela é como a lua parindo desilusão.. Tende piedade das mulheres chamadas desquitadas. Porque nelas se refaz misteriosamente a virgindade. Mas tende piedade também das mulheres casadas. Que se sacrificam e se simplificam a troco de nada.. Tende piedade, Senhor, das mulheres chamadas vagabundas. Que são desgraçadas e são exploradas e são infecundas. Mas que vendem barato muito instante de esquecimento. E em paga o homem mata com a navalha, com o fogo, com o veneno.. Tende piedade, Senhor, das primeiras namoradas. De corpo hermético e coração patético. Que saem à rua felizes mas que sempre entram desgraçada. Que se crêem vestidas mas que em verdade vivem nuas.. Tende piedade, Senhor, de todas as mulheres. Que ninguém mais merece tanto amor e amizade. Que ninguém mais deseja tanto poesia e sinceridade. Que ninguém mais precisa tanto de alegria e serenidade.. Tende infinita piedade delas, Senhor, que são puras. Que são crianças e são trágicas e são belas. Que caminham ao sopro dos ventos e que pecam. E que têm a única emoção da vida nelas.. Tende piedade delas, Senhor, que uma me disse. Ter piedade de si mesma e de sua louca mocidade. E outra, à simples emoção do amor piedoso. Delirava e se desfazia em gozos de amor de carne.. Tende piedade delas, Senhor, que dentro delas. A vida fere mais fundo e mais fecundo. E o sexo está nelas, e o mundo está nelas. E a loucura reside nesse mundo.. Tende piedade, Senhor, das santas mulheres. Dos meninos velhos, dos homens humilhados – sede enfim. Piedoso com todos, que tudo merece piedade. E se piedade vos sobrar, Senhor, tende piedade de mim!",Aparência,Negativo
sujeitoadjetivo,novinha novinha,Vem Me Atravessar,Mc Diguinho,funk-carioca,"Deixa, deixa, deixa (15x). Eu atravessar. Novinha novinha. Deixa, deixa, eu atravessar. Novinha novinha. Deixa, deixa, eu atravessar. Calma que eu boto bem devagarinho. Prometo pra tu que não vo machucar 3x. Mc Pocahontas. Calma, garoto sou muito novinha. Promete pra mim que não vai machucar 3x. Vem, Vem, Vem(6x) me atravessar. Vem, Vem,me atravessar. Mc Doguinha. Deixa, deixa, deixa (15x). Eu atravessar. Novinha novinha. Deixa, deixa, eu atravessar. Novinha novinha. Deixa, deixa, eu atravessar. Calma que eu boto bem devagarinho. Prometo pra tu que não vo machucar 3x",Aparência,Negativo
sujeitoauxadjetivo,novinha tá animadinha,Hoje É Dia de Festinha,Mc Diguinho,funk-carioca,"Hoje é dia de festinha, novinha tá animadinha. Hoje é dia de festinha, novinha tá animadinha. Ela vem, mas não vem sozinha.... Ela vem com as amiguinhas.... Ela vem, mas não vem sozinha.... Ela vem com as amiguinhas.... Ela dá cheia de tesão, Ela dá cheia de tesão,. Uma descidinha, uma descidinha no chão.. Na frente do Diguinho.... Ela dá cheia de tesão, Ela dá cheia de tesão.... Uma descidinha, descidinha no chão.",Aparência,Negativo
sujeitoadjetivo,novinha excitante,Bumbum Fatal,MC Belzinho,funk-carioca,"Carinha de santa jeitinho inocente. Princesinha atraente. Safadinha que adere o bonde. Gostosinha só anda de cyclone. Tantas qualidades já estava me esquecendo. É que a novinha vem se envolvendo. Tantas Qualidade é especial. Novinha excitante do bumbum fatal. já era o refrão?. Bumbum, bumbum, bumbum, bum fatal. Bumbum, bumbum, bumbum, bum fatal. sentou, quicou em cima do meu pau. sentou, quicou em cima do meu pau. Bumbum, bumbum, bumbum, bum. Bumbum, bumbum, bumbum, fatal. sentou, quicou em cima do meu pau. quicou, quicou em cima do meu pau. (segunda parte). Carinha de santa jeitinho inocente. Princesinha atraente. Safadinha que adere o bonde. Gostosinha só anda de cyclone. Tantas qualidades já estava me esquecendo. É que a novinha vem se envolvendo. Tantas Qualidade é especial. Novinha excitante do bumbum fatal. já era o refrão?. Bumbum, bumbum, bumbum, bum fatal. Bumbum, bumbum, bumbum, bum fatal. sentou, quicou em cima do meu pau. sentou, quicou em cima do meu pau. Bumbum, bumbum, bumbum, bum. Bumbum, bumbum, bumbum, fatal. sentou, quicou em cima do meu pau. quicou, quicou em cima do meu pau",Aparência,Positivo
substantivo,novinha já tá na minha mira,Já Ta na Minha Mira,Mc BNN,funk-carioca,"Essa novinha já tá na minha mira já faz um tempão. Tá bem arrumada. Batom da Chanel. Bolsa Louis Vuitton. A onde ela passa chama atenção. A galera começa a olhar. Já tá na minha mira. Não entra na frente. Que agora eu vou atirar. No primeiro tiro eu colei. No ouvido eu falei coisas para ela pirar. No segundo tiro. Bem devagarinho eu já comecei a dançar. Ela no talento entrando na onda. Começou a me acompanhar. Já tá na minha mira. Não entra na frente. Que agora eu vou atirar. Eu atirei, foi bem no alvo. E a patricinha desceu do salto. Eu atirei, foi bem no alvo. E a patricinha desceu do salto. Ela rebola chamando atenção. tá sensualizando mostrando o que é bom. Ela rebola chamando atenção. tá sensualizando mostrando o que é bom",Aparência,Negativo
sujeitoadjetivo,"garotinho, juvenil",Pegada,Ludmilla,funk-carioca,"Saiu explanando, dizendo. Que a noite tá certa de me pegar. Perdeu a chance que eu tinha te dado. De você se aproximar. Garotinho, juvenil, não vai mais rolar. Achou que ia ser fácil. Já veio afobado, querendo encostar. Mostrei que eu não sou garota. Te dou trabalho, tu pode apostar. Vai ter que saber. Vai ter que entender. Que hoje tu vai aprender. Então, para. Deixa eu te ensinar como se faz essa parada. Te dou atenção, mas eu não te prometo nada. É fácil de aprender, depende de você. A gente se envolver, fala. Mostra que aprendeu. Me pega no quarto ou na sala. Agora eu quero ver se aprendeu a ter pegada. Agora diz você, não pode vacilar. Saiu explanando, dizendo. Que a noite tá certa de me pegar. Perdeu a chance que eu tinha te dado. De você se aproximar. Garotinho, juvenil, não vai mais rolar. Achou que ia ser fácil. Já veio afobado, querendo encostar. Mostrei que eu não sou garota. Te dou trabalho, tu pode apostar. Vai ter que saber. Vai ter que entender. Que hoje tu vai aprender. Então, para. Deixa eu te ensinar como se faz essa parada. Te dou atenção, mas eu não te prometo nada. É fácil de aprender, depende de você. A gente se envolver, fala. Mostra que aprendeu. Me pega no quarto ou na sala. Agora eu quero ver se aprendeu a ter pegada. Depende de você, não pode vacilar. Então, para. Deixa eu te ensinar como se faz essa parada. Te dou atenção, mas eu não te prometo nada. É fácil de aprender, depende de você. A gente se envolver, fala. Mostra que aprendeu. Me pega no quarto ou na sala. Agora eu quero ver se aprendeu a ter pegada. Depende de você, não pode vacilar. Saiu. Perdeu. Garotinho, juvenil. Saiu. Perdeu. Garotinho, juvenil",Papel Social,Neutro
sujeitoauxadjetivo,novinha já tá louca,Tá Descendo,Malha Funk,funk-carioca,"Que isso, moleque. Que isso, moleque. Que isso, moleque. Vem com o Malha Funk. Desce com o copinho na boca. Essa mina já tá crazy. As novinha já tá louca. Vem com o Malha Funk. Tem uísque, tem Chandon. Ela já tá louquinha e tá descendo até o chão. Vem com o Malha Funk. Desce com o copinho na boca. Essa mina já tá crazy. As novinha já tá louca. Vem com o Malha Funk. Tem uísque, tem Chandon. Ela já tá louquinha e tá descendo até o chão. Tá causando opinião. Tá querendo aparecer. Me olhando, faz cerinha. Doidinha pra descer. Tá causando opinião. Tá querendo aparecer. Me olhando, faz cerinha. Doidinha pra descer. O estilo parceira. Sempre querendo mais. Depois do quadradinho. Olha só o que ela faz. Tá, tá, tá, tá, tá, tá descendo. Tá, tá, tá, tá, tá, tá subindo. Tá, tá, tá, tá, tá, tá descendo. Tá, tá, tá, tá, tá, tá",Caráter,Negativo
sujeitoadjetivo,novinha danadinha,Vem Sentando,Jonathan Costa,funk-carioca,"Vem sentando,vem sentando com o danadão. A novinha danadinha tá descendo até o chão,. perde a linha,desce e sobe ao som do tamborzão.. O bagulho aqui tá sério,novinha vou te falar,. vem com o danadão e deixe seu corpo balançar. Vem sentando,vem sentando,vem sentando com o danadão,. Vai danada,vai danada,rebolando até o chão (2x). [By Hallana Lisla >Lana Bunekinha< ]",Aparência,Negativo
sujeitoadjetivo,garotinha bonitinha,Ser Bem (1961),Roberto Carlos,jovem-guarda,"Ser bem. É na Copa debutar. É sair todo domingo. Na revista do Couchart. Ser bem. É andar de Cadillac. É dizer que está em ""love"". Mesmo que seja de araque. Toda garotinha bonitinha tem mania. De ser elegante da Bangu. Quer ver o seu nome na coluna todo dia. Pertinho do Jorginho, ao lado do Didu. Ser bem é na Hípica jantar. É no Jóquei desfilar e de noite, no Sacha's. Com Baby, juntinho dançar. Mamãe, eu também quero ser bem. Mamãe, eu também quero ser bem. Toda garotinha bonitinha tem mania. De ser elegante da Bangu. Quer ver o seu nome na coluna todo dia. Pertinho do Jorginho, ao lado do Didu. Ser bem é na Hípica jantar. É no Jóquei desfilar e de noite, no Sacha's. Com Baby, juntinho dançar. Mamãe, eu também quero ser bem. Mamãe, eu também quero ser bem. Mamãe, eu também quero ser bem. Mamãe, eu também quero ser bem. Mamãe, eu também quero ser bem. Mamãe, eu também quero ser bem",Aparência,Positivo
sujeitoadjetivo,mocinho bonito,Mocinho Bonito,Erasmo Carlos,jovem-guarda,Mocinho bonito perfeito improviso. Do falso grã-fino. No corpo é atleta no crânio é menino. Que além do abc nada mais aprendeu. Queimado de sol cabelo assanhado. Com muito cuidado na pinta de conde. Se esconde um coitado. Um pobre farsante que a sorte esqueceu. Contando vantagem. Que vive de renda. E mora em palácio. Procura esquecer um barraco no estácio. Lugar de origem que há pouco deixou. Mocinho bonito. Que é falso malandro de copacabana. O mais que consegue é um trilhão por semana. A mana do peito jamais te negou,Aparência,Positivo
sujeitoadjetivo,mocinho bonito perfeito improviso,Mocinho Bonito,Erasmo Carlos,jovem-guarda,Mocinho bonito perfeito improviso. Do falso grã-fino. No corpo é atleta no crânio é menino. Que além do abc nada mais aprendeu. Queimado de sol cabelo assanhado. Com muito cuidado na pinta de conde. Se esconde um coitado. Um pobre farsante que a sorte esqueceu. Contando vantagem. Que vive de renda. E mora em palácio. Procura esquecer um barraco no estácio. Lugar de origem que há pouco deixou. Mocinho bonito. Que é falso malandro de copacabana. O mais que consegue é um trilhão por semana. A mana do peito jamais te negou,Aparência,Positivo
sujeitoadjetivo,criança magrinha,Velho Sermão,Ronnie Von,jovem-guarda,"Um velho de barba bem comprida. Numa praça bem perto da estação. Com Jesus numa cruz toda encardida. Contava histórias do sertão. Sem saída caíram no mesmo beco. O boi que virou ossada só. O arvoredo que hoje é galho seco. E o rio que hoje é pedra e pó. De repente ele entristeceu a fala. O José foi ao brejo sem voltar. O João sucumbiu levando bala. E Maria casou longe do altar. A criança magrinha e barriguda. Tem farinha com água quando tem. Ele diz para o povo não se iluda. Essa terra do inferno é refém. Quase sol no mormaço, pouco brilho. Maldição fez um mal que não se faz. Fez partir sua mulher e os seus filhos. Nos trilhos do trem do nunca mais. E o povo baixando a cabeça. Como se pro sermão dissesse amém. Apesar dessa vida tão avessa. Ainda guarda a ilusão do sol que vem",Aparência,Negativo
sujeitoadjetivo,criança insatisfeita,"Ciça, Cecilia",Erasmo Carlos,jovem-guarda,"Ciça, Cecilia. Erasmo Carlos - Roberto Carlos. Se alguém soubesse nesse mundo. Pode ser um rei ou vagabundo. Que bem no coração do meu país. Namora e mora alguém que sabe e diz. Mesmo que não tenha o que falar. E a comunicação se faz presente. Em tudo que seu peito faz e sente. Procura demonstrar que não é triste. Procura um amor que não existe. E sabe que jamais vai encontrar. Ciça, Ciça, Cecília. Seu ídolo, seu mestre, seu santo padroeiro. Só pode, só pode ser o Velho Guerreiro. Seu sonho é ser um dia dica do Pasquim. Só ouve Caetano, Teixeirinha e Tim. É gente de verdade como deve ser. Ciça, Ciça, Cecília. E é mulher – criança insatisfeita. Que tem suas razões pra ser perfeita. O seu sorriso – riso é aberto. Seus olhos nos enxergam bem de perto. O mundo inteiro tem que conhecer. Ciça, Ciça, Cecília. Pode ser confusa, minha musa, que eu não ligo...",Neutro,Negativo
sujeitoauxadjetivo,criança é bom,Bolinha de Sabão,Trio Esperança,jovem-guarda,Sentado na calçada. De canudo e canequinha. Dumplec duplim. Eu vi um garotinho. Dumplec duplim. Fazendo uma bolinha. Dumplec duplim. Bolinha de sabão. Eu fique a olhar. Eu pedi para ver. Quando ele me chamou. E pediu pra com ele brincar. Foi então que eu vi. Como era bom brincar. Com bolinha de sabão. Ser criança é bom. Agora vou passar. A fazer bolinha de ilusão,Caráter,Positivo
sujeitoadjetivo,garotinho inocente,O Menino e O Cachorro,Abel & Caim,sertanejo,Na beira do Rio do Peixe num lugar bem retirado. Residia um lavrador com um ano de casado. Tinha um filhinho de colo que nem era batizado. Apesar de muito pobre vivia tranquilizado. E quando o dia raiava a canoa ele pegava. O rio ele atravessava pra cuidar do seu roçado.. Certo dia o lavrador muito bem intencionado. Resolveu de por em frente um serviço atrasado. Levou a mulher pra roça com matula e virado. Deviam voltar mais cedo por isso haviam deixado. Naquele ranchinho ausente o garotinho inocente. Que sonhava sorridente no seu berço mal forrado.. Uma grande tromba d'água desabou naquele lado. O rio encheu de repente que ficou tudo alagado. O mais alto dos barranco tambem ficou tansbordado. Quiseram voltar pra casa canoa tinha rodado. Que destino traiçoeiro daquele casal roceiro. Olhando aquele aguaceiro gritando desesperado.. Um cachorro policial esperto e bem ensinado. Dormindo em baixo da cama por sorte havia ficado. Quando viu que aquele rancho ia ser tudo inundado. Tentou salvar a criança pra não morrer afogado. Entrelaçou no seus dentes o garotinho inocente. E num gesto de valente atravessou o rio a nado.. O casal ja lamentando em gestos desesperados. A morte do seu filhinho que as águas tinha levado. Logo viram o cachorro completamente molhado. Farejando o garotinho que ele havia salvado. Pela força do destino o cão salvou o menino. Este milagre divino foi por Deus determinado.,Caráter,Positivo
sujeitoadjetivo,garotinho inocente,O Cachorro E O Menino,Abel & Caim,sertanejo,CACHORRO E O MENINO. Na beira do rio do peixe num lugar bem retirado. Um casal de lavrador com um ano de casado. Tinha um filhinho de colo que nem era batizado. Apesar de muito pobre viviam bem sossegados. E quando o dia raiva à canoa ele pegava. O rio ele atravessava pra cuidar do seu roçado. Certo dia o marido muito bem intencionado. Precisando terminar um serviço atrasado. Levou a mulher pra roça com matula e virado. Pensando voltar mais cedo eles haviam deixado. Naquele ranchinho ausente um garotinho inocente. Que sonhava sorridente no seu berço mal forrado. Uma grande tromba d´água desabou daquele lado. O rio encheu de repente que ficou todo alagado. O mais alto do barranco também ficou transbordado. Quiseram voltar pra casa canoa tinha rodado. Que destino traiçoeiro do pobre casal roceiro. Olhando aquele aguaceiro gritando desesperado. Um cachorro policial esperto e bem ensinado. Dormindo em baixo da cama por sorte havia ficado. Quando viu que aquele rancho ia ser todo inundado. Tentou salvar o menino pra não morrer afogado. Entrelaçou nos seus dentes o garotinho inocente. E num gesto de valente atravessou o rio a nado. O pobre casal chorava em pranto desesperado. A morte do seu filhinho que as águas tinha levado. Quando viram o cachorro completamente molhado. Arrastando o garotinho que ele havia salvado. Pela força do destino o cão salvou o menino. Este milagre divino foi por Deus determinado.,Caráter,Positivo
sujeitoadjetivo,garotinho inocente,Casco de Boi,Abel & Caim,sertanejo,"Na capital de São Paulo numa noite de São João. Eu fui cantar na mansão de um rico fazendeiro. Quando eu entrei na casa só via gente importante. Em cima de uma estante eu avistei um cinzeiro. Era um casco de boi transformado em tesouro. Todo machetado a ouro e brilhante verdadeiro. Passei a noite cantando e festa estava animada. Só no fim da madrugada que a viola emudeceu. Os convidados partiram, vinha rompendo a aurora. Mas antes de ir embora cumprir o destino meu. De tanta curiosidade perguntei ao fazendeiro. A origem do cinzeiro, ele assim me respondeu. Esse cinzeiro é o casco de um famoso boi preto. Da boiada que em Barretos há muito tempo estourou. Um garotinho inocente que sozinho estava brincando. Esse boi chegou bufando, na sua frente parou. Talvez guiado por Deus com as guampas aguçadas. Foi rebatendo a boiada e o menino ele salvou. O pai daquele menino na mesma hora comprou. O boi preto que salvou o seu filho na avenida. Quando o boi morreu de febre ele foi no joalheiro. Do casco fez o cinzeiro, sua joia mais querida. Eu sou aquele menino, meu velho pai já se foi. Esse casco é do boi que salvou a minha vida. (Pedro Paulo Mariano - Santa Maria da Serra-SP)",Caráter,Positivo
sujeitoadjetivo,mocinha bonita,Alto Falante da Praça,Abel & Caim,sertanejo,"Sentado a beira da cama. Pensando na vida com radio ligado. Naquilo tocou uma musica. Que marcou demais meu distante passado.. Era uma linda musica. A mesma que um dia no interior. No alto falante da praça. Alguém me ofertava com prova de amor.. Deus meu deus traga pra junto de mim. Este alguém que me faz chorar e me faz sofrer tanto assim. Deus, meu Deus tenha piedade de mim. Faça com que ele volte viver sem ela será o meu fim.. Enquanto ouvia a música. Lembrei-me de tudo da vida passada. Lembrei da mocinha bonita. Que foi minha ingênua e file namorada.. Lembrei da ultima hora. Que eu vinha embora, então no jardim. Do alto falante da praça. Então a pedido dela tocou para mim.",Aparência,Positivo
sujeitoadjetivo,criança feliz,Canção da Criança,Angela Maria,velha-guarda,"Criança feliz, feliz a cantar. Alegre a embalar, seu sonho infantil. Ô meu bom Jesus, que a todos conduz. Olhai as crianças do nosso Brasil. Crianças com alegria, qual um bando de andorinhas. Viram Jesus que dizia: Vinde a mim as criancinhas. Hoje no céu num aceno, os anjos dizem Amém. Porque Jesus Nazareno foi criancinha também",Emoção,Positivo
sujeitoadjetivo,"criança feliz, feliz",Canção da Criança,Angela Maria,velha-guarda,"Criança feliz, feliz a cantar. Alegre a embalar, seu sonho infantil. Ô meu bom Jesus, que a todos conduz. Olhai as crianças do nosso Brasil. Crianças com alegria, qual um bando de andorinhas. Viram Jesus que dizia: Vinde a mim as criancinhas. Hoje no céu num aceno, os anjos dizem Amém. Porque Jesus Nazareno foi criancinha também",Emoção,Positivo
sujeitoadjetivo,bonequinha inteligente,Ju-ão,Vicente Celestino,velha-guarda,"Lá na prateleira de um bazar. Moravam dois bonequinhos de pano. Ninguém se lembrava de os comprar. Passavam de um mês. Passava um ano. Mas para o boneco de repente. A vida transformou-se num dilema. Notaram a bonequinha inteligente. E levaram a bonequinha pro cinema. Hoje a bonequinha vive cortejada. Dorme entre sedas, não lhe falta nada. E já nem sequer se lembra que ainda existe. Lá jogado num bazar. Um bonequinho triste. Mas se quer tirar alguém do coração. Fica zangadinha chama de Ju-ão. E o bonequinho triste daquele bazar. Diz que ele é Ju-ão também. E pra boneca ele é um Ju-ão-ninguém",Caráter,Positivo
sujeitoadjetivo,criança feliz,Canção da Criança,Francisco Alves,velha-guarda,"Brincando, marcha o menino de hoje.. Lutando, marchará o menino de amanhã.. Crianças despreocupadas desse Brasil-Menino,. cujas glórias hão de colher os homens grandes. que dominarão o Brasil-Gigante. esse Brasil grandioso que eu canto,. que as crianças da Casa de Lázaro. felizes cantarão, numa esperança. de vitórias e alegrias.. Criança feliz, que vive a cantar. alegre embalar seu sonho infantil. ó meu bom Jesus, que a todos conduz. olhai as crianças do nosso Brasil!. Criança feliz, que vive a cantar. alegre embalar seu sonho infantil. ó meu bom Jesus, que a todos conduz. olhai as crianças do nosso Brasil!. Crianças com alegria. qual um bando de andorinhas. viram Jesus que dizia:. Vinde a mim as criancinhas!. Hoje dos céus num aceno. os anjos dizem amém. porque Jesus Nazareno. foi criancinha também!. Criança feliz, que vive a cantar. alegre embalar seu sonho infantil. ó meu bom Jesus, que a todos conduz. olhai as crianças do nosso Brasil!. Criança feliz, que vive a cantar. alegre embalar seu sonho infantil. ó meu bom Jesus, que a todos conduz. olhai as crianças do nosso Brasil!. Crianças com alegria. qual um bando de andorinhas. viram Jesus que dizia:. Vinde a mim as criancinhas!. Hoje dos céus num aceno. os anjos dizem amém. porque Jesus Nazareno. foi criancinha também!. Criança feliz, que vive a cantar. alegre embalar seu sonho infantil. ó meu bom Jesus, que a todos conduz. olhai as crianças do nosso Brasil!. Criança feliz, que vive a cantar. alegre embalar seu sonho infantil. ó meu bom Jesus, que a todos conduz. olhai as crianças do nosso Brasil!",Emoção,Positivo
