Padrão,Frase,Nome da Música,Nome do Artista,Gênero Musical,Letra da Música,Categoria,Sentimento
sujeitoadjetivo,bebê igual,Bêbado Mais Bêbado,Felipe Araújo,sertanejo,"Dá uma olhada no estoque. Pra ver se tem cerveja o suficiente pra essa noite. Tô precisando é de um choque. Pra aceitar que aquilo não foi pé na bunda, foi um coice. Enquanto eu bebo, um copo vai enchendo o outro. Pra não dar o intervalo de lembrar daquele rosto. E que rosto, e que boca, e que corpo, e que gosto!. Vai, vai, enche, enche o copo, que ainda não tô louco. Hoje a cidade vai ver. O bêbado mais bêbado chorar por você. Se não voltar por amor. Volta pelo menos pra me socorrer. Hoje a cidade vai ver. O bêbado mais bêbado chorar por você. Coração não entendeu. Como cê tem coragem de abandonar um bebê igual eu. Enquanto eu bebo, um copo vai enchendo o outro. Pra não dar o intervalo de lembrar daquele rosto. E que rosto, e que boca, e que corpo, e que gosto!. Vai, vai, enche, enche o copo, que ainda não tô louco. Hoje a cidade vai ver. O bêbado mais bêbado chorar por você. Se não voltar por amor. Volta pelo menos pra me socorrer. Hoje a cidade vai ver. O bêbado mais bêbado chorar por você. Coração não entendeu. Como cê tem coragem de abandonar um bebê igual eu. Um bebê igual eu",Neutro,Neutro
sujeitoauxadjetivo,criança é sincera,Trate Bem Suas Crianças,Quinteto em Branco e Preto,samba,"A criança é uma coisa tão bela. Uma coisa tão linda. Pequenina, a criança é sincera. A criança é maneira. Peço a Deus que ela cresça. E ainda se torne um adulto. E não fique perdida no mundo. Fazendo besteira. Eu também já fui criança. Fui feliz, tive meu lar. Desde o dia em que nasci. Tive alguém pra me inspirar. Que me ensinou a sorrir. Andar, falar. Me ensinou tudo que sei. Hoje eu sei pra ensinar. Ciranda, cirandinha. Eu só quero me lembrar. Trate bem suas crianças. Não deixe o bicho pegar",Caráter,Positivo
substantivo,criança é uma coisa,Trate Bem Suas Crianças,Quinteto em Branco e Preto,samba,"A criança é uma coisa tão bela. Uma coisa tão linda. Pequenina, a criança é sincera. A criança é maneira. Peço a Deus que ela cresça. E ainda se torne um adulto. E não fique perdida no mundo. Fazendo besteira. Eu também já fui criança. Fui feliz, tive meu lar. Desde o dia em que nasci. Tive alguém pra me inspirar. Que me ensinou a sorrir. Andar, falar. Me ensinou tudo que sei. Hoje eu sei pra ensinar. Ciranda, cirandinha. Eu só quero me lembrar. Trate bem suas crianças. Não deixe o bicho pegar",Papel Social,Neutro
substantivo,criança é maneira,Trate Bem Suas Crianças,Quinteto em Branco e Preto,samba,"A criança é uma coisa tão bela. Uma coisa tão linda. Pequenina, a criança é sincera. A criança é maneira. Peço a Deus que ela cresça. E ainda se torne um adulto. E não fique perdida no mundo. Fazendo besteira. Eu também já fui criança. Fui feliz, tive meu lar. Desde o dia em que nasci. Tive alguém pra me inspirar. Que me ensinou a sorrir. Andar, falar. Me ensinou tudo que sei. Hoje eu sei pra ensinar. Ciranda, cirandinha. Eu só quero me lembrar. Trate bem suas crianças. Não deixe o bicho pegar",Papel Social,Neutro
sujeitoadjetivo,"pivete, sua preta",Fui Bandido,Quinteto em Branco e Preto,samba,"Fui bandido. E da vida bandida sai sem vacilo. Pois entrei consciente que o crime é o bicho, é aquilo. E quem pula do bonde conhece a real. Lá no morro isso é normal. E bandido. Quanto mais é responsa. Mais é perseguido. Vagabundo quer mais encontrar um motivo. Pra te por no vacilo e depois conspirar. Mas eu subi na cancha tim-tim por tim-tim. Respeitei os parceiros levei na moral. E de dentro pra fora veio o catatau. E o amigo pedindo pra eu assumir, e assumi. Tive dias de glória, mas tudo tem fim. De repente a policía toda atrás de mim. E a sociedade a me detestar. Uma par de inimigo querendo meu fim. E eu sentindo na pele que ia rodar e rodei. E é por isso que hoje eu estou aqui. Amargando o peso da minha sentença. Ao contrário daquilo que essa gente pensa. Com o crime aprendi. Que o crime não compensa. CARTA AO DETENTO. (Edi Rock). É irmão. Você abriu seu coração. Ouvi com atenção, emoção, comoção, pois não. Eu tô aqui se precisar de uma palavra. Amiga e sincera, e pra muitos não é nada. Um homem na estrada recomeça sua vida. Sua finalidade, e sua despedida. Despedida sim, de fim um adereço. Um save pra você que pensa em recomeço irmão. ""Cê"" é da hora então, ""Garre"" uma chance. A chance da mudança, esperança e revanche. A chance de mostrar o talento que ""cê"" tem. Eu torço por você, pelos seus na paz também. Que seu bem, e que você seja feliz. Seu pivete, sua preta, seu castelo, a planta e a raiz. No que me diz respeito, me sinto honrado. Em escrever essas palavras pra você, meu aliado",Aparência,Neutro
sujeitoadjetivo,criança triste,Eu Choro,Sorriso Maroto,pagode,"Eu choro. Com saudade de você. Nosso quarto esta do jeito que você deixou. Nossas fotos sobre a cama. No lençol sinto seu cheiro. Sua imagem na varanda. Só confunde o meu desejo. Mas não perco a esperança. Pois quem ama quer voltar. Quando o coração balança. Não dá pra segurar. Você chega assim. Feito uma criança triste a chorar. Me pedindo colo. Louca pra ficar. Aqui, a sós. No nosso mundo e eu. De braços abertos sou seu Redentor. De olhos fechados pra fazer amor. Aqui, a sós. E outra vez eu choro",Emoção,Negativo
substantivo,criança é paz,Pixote,Zeca Pagodinho,pagode,"Criança é paz,ternura,é o doce sabor. É uma planta,. Criança é o fruto de uma dor.. Não há contratempo,nem chuva,nem vento. É um ser de luz que desponta. Que eterniza a lembrança pra vida.. Quisera ser um jurado. Pra condenar o mal com amor.. Fazer de todo curumin. A flor mais bela do jardim. Canção gostosa pra ninar. E com sorriso despertar. Esse pingo de gente. Meu pixote inocente. Sentimento no ar.",Emoção,Positivo
substantivo,criança é o fruto,Pixote,Zeca Pagodinho,pagode,"Criança é paz,ternura,é o doce sabor. É uma planta,. Criança é o fruto de uma dor.. Não há contratempo,nem chuva,nem vento. É um ser de luz que desponta. Que eterniza a lembrança pra vida.. Quisera ser um jurado. Pra condenar o mal com amor.. Fazer de todo curumin. A flor mais bela do jardim. Canção gostosa pra ninar. E com sorriso despertar. Esse pingo de gente. Meu pixote inocente. Sentimento no ar.",Papel Social,Neutro
sujeitoadjetivo,criança velho,Normas da Casa,Zeca Pagodinho,pagode,"Normas da Casa. Dá próxima vez que quiser me visitar avisa, vai lá, mas avisa. Porque vou as normas da casa mudar.. Quem não for amigo só entra de crachá pra moralizar vou ter que mudar. Dá próxima vez que quiser me visitar avisa, vai lá, mas avisa. Porque vou as normas da casa mudar.. Quem não for amigo só entra de crachá pra moralizar vou ter que mudar. Dessa vez foi demais você trouxe a família da sua vizinha comadre, compadre cunhada e madrinha.. Fizeram uma zorra lá no meu quintal total. Sanfona viola cavaco pandeiro, rolou o samba,forró, hip hop de tudo por lá. Babou, chegaram bem na hora que eu ia almoçar. Colou, quando eu falei servido um já estava em meu lugar. Sujou, comeram e beberam quase tudo, que povo mal educado lá foi meu frango com quiabo. Que horror, zoaram o dia todo e ninguém tinha disciplina. Sujou, criança velho e jovem se jogaram na piscina. Bastou, quando a farra acabou já era noite não deu mais pra me segurar,mandei todo mundo vazar.. Dá próxima vez que quiser me visitar avisa, vai lá, mas avisa. Porque vou as normas da casa mudar.. Quem não for amigo só entra de crachá pra moralizar vou ter que mudar. Dessa vez foi demais você trouxe a família da sua vizinha comadre, compadre cunhada e madrinha.. Fizeram uma zorra lá no meu quintal total. Sanfona viola cavaco pandeiro, rolou o samba, forró, hip hop de tudo por la.. Babou, chegaram bem na hora que eu ia almoçar. Colou, quando eu falei servido um já estava em meu lugar. Sujou, comeram e beberam quase tudo, que povo mal educado lá foi meu frango com quiabo. Que horror, zoaram o dia todo e ninguém tinha disciplina. Sujou, criança, velho e jovem se jogaram na piscina. Bastou quando a farra acabou já era noite não deu mais pra me segurar, mandei todo mundo vazar.. No dia seguinte fui fazer faxina caramba quase que enfartei. De tanta sujeira na minha piscina que a mãe de quem foi lá xinguei. Osso de galinha, pilha, dentadura, peruca, garrafa, carvão, lata de cerveja, maiô, camisinha, e uma cueca samba canção.. Bolinha de gude, chapinha cabelo a água tão amarelada tava na cara que ali foi banheiro desaperto da rapaziada. Não diz que é mentira foi tudo filmado, só pra você dou perdão. Porém sua turma me deixou bolado nunca mais, nem no portão ah não!. Dá próxima vez quiser me visitar avisa...",Aparência,Neutro
sujeitoauxadjetivo,novinha tá nervosa,Sarrada no Ar,Thiago San'n,pagode,"Postou no face que estava estressada. Brigou e agora deu um corte na catuaba. Tirou a roupa e tá embrasada. A novinha tá nervosa querendo sarrada. A novinha tá nervosa querendo sarrada. Sarrada, Sarrada, Sarrada, Sarrada, Sarrada, dar uma Sarrada no Ar. Sarrada, Sarrada, Sarrada, Sarrada, Sarrada, dar uma Sarrada no Ar. Sarrada, Sarrada, Sarrada, Sarrada, Sarrada, dar uma Sarrada no Ar. Sarrada, Sarrada, Sarrada, Sarrada, Sarrada, dar uma Sarrada no Ar",Aparência,Negativo
sujeitoadjetivo,criança inocente,Manera Mané,Zeca Pagodinho,pagode,"Hoje o mundo tá diferente. É fera engolindo fera. Quem der com a língua nos dentes. Já sabe que o mal lhe espera. Qualquer criança inocente. Já sabe o que isso gera. Tem gente filmando a gente Mane. Manera Mané, manera. Manera, manera, manera, manera. Mané. Manera mané, manera. Te carto desde menino. A gente ainda era pivete. No tempo do Juscelino. Você já pintava o sete. Seu papo de escancarar. Faz parte de outra era. Por isso vem devagar, sai pra lá. Manera mané, manera. Manera, manera.... Não vou segurar pepino. Se a coisa não me compete. Você faz seu desatino. Depois vem jogar confete. Não estou aqui pra brincar. Só gosto de jogo à vera. Por isso é melhor parar, sai pra lá. Manera mané, manera. Manera, manera, manera, manera. mané. Manera Mané, manera",Caráter,Neutro
sujeitoadjetivo,criança inocente,"Alô, Mundo",Zeca Pagodinho,pagode,"Alô mundo, olha eu aqui. Sou alguém, e isso desde que eu nasci. Porém sei lá, cansei de perguntar. Cadê papai, mamãe, não sei onde andará. Nem conheci, pois me deixaram pequenino. Entregue a própria sorte do destino. E assim, hoje eu sou menor abandonado. O espelho vivo o resultado. De mais um problema social. Por ser meu ser, uma agitação de corpo e alma. De todos os dramas, e todos os traumas. Dizem que sou a causa principal. Não faz assim comigo não, necessito de atenção. Me dê a mão, não me trate diferente. Alô mundo, me ajude a ser gente. Pois no fundo sou uma criança inocente. Não faz assim comigo não, necessito de atenção. Me dê a mão, não me trate diferente. Alô mundo, me ajude a ser gente. Pois no fundo sou uma criança inocente",Caráter,Neutro
sujeitoadjetivo,novinha envolvente,Psico Só Usa Ecko,Menor do Chapa,funk-carioca,"é o bonde do rinocerante,. é o bonde do rinocerante,. Bonde que usa só rinoceronte,. Bonde que usa só rinoceronte,. é o bonde do rinocerante. Bonde que usa só rinoceronte,. Bonde que usa só rinoceronte,. é o bonde do rinocerante. psico só usa Ecko,. psico só usa Ecko,. psico só usa Ecko,. Vários bracelete de ouro,. Mais de 1kg no pescoço,. Motorizado 1100, com varios milhão no bolso,. as novinha envolvente não entende o nosso mundo, ""vida. loka"", ""dog Style"" no estilo vagabundo.. Esse é o bonde do homem.. Bonde que usa só rinoceronte,. Bonde que usa só rinoceronte,. Bonde que usa só rinoceronte,. Bonde que usa só rinoceronte,. é o bonde do rinoceronte,. esse é o bonde do home.. psico só usa Ecko,. psico só usa Ecko,. psico só usa Ecko,. Vários bracelete de ouro,. Mais de 1kg no pescoço,. Motorizado 1100, com varios milhão no bolso,. as novinha envolvente não entende o nosso mundo, ""vida. loka"", ""dog Style"" no estilo vagabundo.. esse é o bonde do home.. Bonde que usa só rinoceronte,. Bonde que usa só rinoceronte,. Bonde que usa só rinoceronte,. Bonde que usa só rinoceronte,. é o bonde do rinoceronte,. (limitada 1100)",Aparência,Positivo
sujeitoadjetivo,novinha tarada,Aquecimento Das Potrancas,Mc Wm,funk-carioca,"Senta novinha. Quica malvada. Rebolando a raba. Dando bum bundada. Senta novinha. Quica malvada. Bum, bum, bum, bum,. bum, bundada. (2x). Toma. Ahn, vai (2x). Novinha tarada. Tá muito abusada. Sentando e descendo. No chão ela vai. Cai, cai, cai.... É o Wm e Jk. No aquecimento das potrancas. Quica e rebola. Vai na dança. Bala, balança a busanfa (2x). E joga a potranca. E não se acanha. Empina a potranca. E toma, toma, toma (5x). Quica e rebola. Vai na dança. Bala, balança a busanfa (2x). Tá danadinha. Tremendo a bundinha. Jogando por cima. Rebola menina. Entrando no clima. Perdendo a linha. Com as amiguinhas. Pagando marquinha. Assim fica bom. Assim tá demais. Joga a bundinha. Pra frente e pra trás. Novinha tarada tá muito. abusada, sentando e descendo. no chão ela vai.. Up, up, up, up.... Jogando por cima. Rebola no clima. Empina menina. Despenca e cai",Aparência,Negativo
sujeitoadjetivo,novinha louca,É Tipo Metralhadora,Mc Wm,funk-carioca,Ela fica loucona e senta. An an an an an. An an an an an. An an an an an. Vai an an an an. An an an an an. Mas primeiro vamos chamar todas elas. Meninas. An an an an an an. An an an ana an an. An an an an an an. Meninas tu gosta né?. Pensa que é mentira. Quando o grave faz tum o bumbum dela desce. Tum bumbum dela desce. Quando o grave faz tum o bumbum dela desce. Tum bumbum dela. Danadinha já desce. Danadinha já desce. Danadinha já desce. É só bumbum que desce. Danadinha já desce. Que desce que desce. Vai no chão e estremece. Qual foi chara? aquele pontinho lá. Estremece quando ela desce batendo a bunda no chão. Estremece quando ela desce. batendo batendo batendo a bunda no chão. No baile da dz7 nois te da catucadão. No baile da marcone nois te da catuca. Estremece quando ela desce batendo a bunda no chão. Ô novinha tu que pediu agora que toma toma. Geral do baile agora te conhece. Ta com apelido novo de piranha. E a novinha taradinha foi para lá no helipa. E bum balança e balança já sabe ne. Ta tarada essa danada na dz7 ela trava. Bum balança balança balança vai. Com a potranca. Ela ta. Ta sarrando em mim. Ta sarrando em tu. Opa opa opa da licença moça. Que o wm vai sarrando em tu garota. Ela rebola desenrola flexiona. Ta sacudindo. Explodindo tpo bomba. Que é o bumbum que balança. Entao joga essa pontraca. E toma toma. Toma toma. E só bala de ak. Só sequencia de papum. É tipo metralhadora o que faz com o bumbum. Treme o bum bum. An an an. Treme o bum bum. An an an. Treme o bum bum. An an an. Treme o bum bum. An an an. Wm manda a boa ta tarada essa garota. Querendo em sarra em tu. É tipo metralhadora o que ela faz com bumbum. Para para para na posição. Parana parana para na posição. Faz tum tum tum tum tum tum tum. Treme tum tum tum tum. Tá leve e solta vai pro baile embrazar. Chama todas as amigas pra curtir e zoar. Eita novinha louca não ta entendo. O pancadão rolando solto e tu se envolvendo. Faz tum tum tum tum tum tum. Tum tum tum tum a tum tum tum a. Para para para para na posição,Caráter,Negativo
sujeitoadjetivo,novinha gata,Bonde da Shineray,Mc Yuri BH,funk-carioca,"O nosso bonde só porta novinha de elite no estilo modelo. E lá de cima eu ganhei no salão a mais linda. a mais top do baile inteiro. Novinha gata mais cobiçada todo mundo quer dar condição. Mas eu ganhei que chego de sonata. com as mina da situação. Ela gosta de curtir dançar gosta de dançar dançar. Fecha comigo novinha fecha vem novinha. Geral no baile paro. Ninguém conseguiu acreditar. Logo depois do baile ela parou na minha. Vem que nós é foda. Mandei reserva, o nosso camarote que é pra nós zoa. Então vem novinha me diz que tu vai. depois do baile na garupa da shineray. Sou novinho não posso forga de 1100. Ta tranquilo logo mais eu vou portar também. Na balada nós fecha camarote área vip. Pega nada com nós só as novinha de elite. Eu não sei daqui pra onde é que nós vai. mas eu sei que o bonde vai de shineray. Vem que nós é foda. Mandei reserva o nosso camarote que é pra nós zoa. Então vem novinha me diz que tu vai. depois do baile na garupa da shineray",Aparência,Positivo
sujeitoauxadjetivo,novinha ta safada,Simultaneamente,MC TL,funk-carioca,"[mc tl]. Ta porra luan, e esse beat inteligente viado. Toda cena ela rouba. Ela ta sempre na moda. Se é vip, ela cola. Ela trava ela joga. Se envolve com os maloca. Porque eu sei que voce gosta. Então voce se prepara. E vem sentar na piroca. A novinha ta safada. E ja sentou no piru. Se tu me der liberdade. Eu ja ponho no teu. Ela bafora e senta simultaneamente. Ela traga e senta simultaneamente. Ela traga e bafora sem culpa na mente. E depois quer fazer tudo isso novamente. [mc gulart]. Ela bafora e senta simultaneamente. Ela traga e senta simultaneamente. Ela traga e bafora sem culpa na mente. E depois quer fazer tudo isso novamente. No rasante com o tl. Altas horas da madrugada. Fechamos o camarote. E mais de 15 garrafas!. Clima quente, só loucura. Eu não tava nem ai!. Só apontei pra ela na pista. E pedi pra ela subi!. Ela toda sorridente. Agradeceu pelo convite. Eu falei que tá tranquilo. Mas no final é suíte!. Envergonhada, respondeu. E falou que era isso!. Mas que só ia colar. Se eu aceitasse um pedido. Exigiu hidromassagem. Quarto com teto retrátil. Pra sentar à noite inteira. Vendo um céu estrelado!. Ela bafora e senta simultaneamente. Ela traga e senta simultaneamente. Ela traga e bafora sem culpa na mente. Ta loca pra fazer tudo isso novamente. [mc tl]. Ela bafora e senta simultaneamente. Ela traga e senta simultaneamente. Ela traga e bafora sem culpa na mente. E depois quer fazer tudo isso novamente. Hoje tu vai se amarrar. Quando eu giro o capital. Só pra tu ficar feliz. O quarto é presidencial. Já pedi uma garrafa. E acendi um baseado. Ela já começou a dançar. Pra me deixar excitado. Ela me falou amor. Pra fuder coloca um som. Eu chamei num som bolado. E trouxe a dom pérignon. Depois sucessivamente. Tava de 4 pelada. Estapiando o bumbum. Dessa danada. Só que depois de manha. Eu quero que voce suma. Antes de a gente ir embora. Vem pra banheira de espuma. Ta porra luan. Ta cachorra hein. Tl e gulart, é isso. [mc tl]. Ela bafora e senta simultaneamente. Ela traga e senta simultaneamente. Ela traga e bafora sem culpa na mente. E depois quer fazer tudo isso novamente. [mc gulart]. Ela bafora e senta simultaneamente. Ela traga e senta simultaneamente. Ela traga e bafora sem culpa na mente. E depois quer fazer tudo isso novamente. Ela bafora e senta simultaneamente. Ela traga e senta simultaneamente. Ela traga e bafora sem culpa na mente. E depois quer fazer tudo isso novamente. [mc tl]. Ela bafora e senta simultaneamente. Ela traga e senta simultaneamente. Ela traga e bafora sem culpa na mente. E depois quer fazer tudo isso novamente",Aparência,Negativo
sujeitoadjetivo,novinha novinha,Pra Todas As Novinhas,Mc Smith,funk-carioca,"Pra todas as novinhas.... Com os conflitos penetrantes.... Vai pra todas as novinhas.... Pra todas as novinhas...Pra todas as novinhas.. Tá no baile, tá dançando tá com tcheca suadinha vai pra treta toma um banho vem com tcheca limpinha. Tão vem com xerequinha,tão vem com xerequinha.tão vem com xerquinha. Vem com tcheca limpinha.... Tão vem com xerequinha,tão vem com xerequinha,tão vem com xerequinha...Óh essa porra é foda.. Óh essa foda é porra.... Com conflitos penetrantes.... Vai pra todas as novinhas,pratodas as novinhas,pra todas as novinhas,pra todas as novinhas.... Tá no baile, tá dançando tá com tcheca suadinha vai pra treta toma um banho vem com tcheca limpinha.... Tão vem com xerequinha,tão vem com xerequinha,tão vem com xerequinha,tão vem com xerequinha.... Porra venhasem gracinha.... Vai pra todas as novinhas,pra todas as novinhas,pra todas as novinha, pra todas as novinhas.... Vem com a tcheca limpinha.... Essa porra é foda.... É pra todas as novinhas.... Novinha...Novinha...Especialmente.... Essa é foda porra.... Com conflitos penetrantes.... É pra todas as novinhas, pra todas as novinhas, pra todas as novinhas.... Tá no baile tá dançando tá com tcheca suadinha vai pra treta toma um banho.... Tão vem com xerequinha,tão vem com xerequinha,tão vem com xerequinha.... Porra venha sem gracinha.... Vai pra todas as novinhas,pra todas as novinhas,pra todas as novinhas.... Vem com a tcheca limpinha.... Óh essa porra é foda.... Vai pra todas as novinha.... Novinha novinha especialmente",Aparência,Negativo
sujeitoadjetivo,novinha taradinha,Chega de Créu !,Mc Tevez,funk-carioca,Acende o fininho. Rola o já rule. Usa o L.L remedinho lança perfume. Acende o fininho. Rola um pastel. Se o cica pega novinha vai rola claro a seqüência de creuu. Creu creu creu creu si ligo di novo. Creu creu creu creu creu creu continua fácil né. Di novo creu creu creu creu creu creu creu creu. Ta ficando difícil em crêu creu creu creu crêu creu ...... Ta aumentando mane crecrecrecreuuuuuu .... Chega de creu chega de creu. Novinha safadinha agora eu vo divulga. Cica divulga o creu o tevez divulga haaaaa. Haaaaaaaaaaaa haaaaaaaaaaaa haaaaa hahaha. Sequencia hahahahaha. Novinha taradinha a putaria vai começa. Se calou na seqüência de creu. Sem neurosee haaaaaaaaaaaaaaaa haaaaaaaaaa haa hahahahhahahaha. Geral no baile aaaaaaa ... As novinha vai gosta as solteira se amarra. Quando o bonde divulga é seqüência di é seqüência di é seqüência di pega elas. Haaaaaa haaaaa haaaaaa há há há há há. Bota ela pra chora. Chama ela pra se amarra. A novinha vai dança quando o bonde divulga. É seqüência di é seqüência di haa haaaa haaaaa há haaa. Ai kii deliciaa ... PsiiKiinHa OriGiiNaL² duu V.D.G,Aparência,Negativo
sujeitoadjetivo,criança pobre,Rep,Gilberto Gil,mpb,"O povo sabe o que quer. Mas o povo também quer o que não sabe. O povo sabe o que quer. Mas o povo também quer o que não sabe. O que não sabe, o que não saberia. O que não saboreia porque é só visão. E tão somente cores, a cor do veludo. Ludo, luz, brinquedo, ledo engano, tele. Teletecido à prova de tesoura. Que não corta, não costura, que não veste. Que resiste ao teste da pele, não rasga. Nunca sai da tela, nunca chega à sala. Que é pura fala, que é beleza pura. É a pura privação de outros sentidos tais. Como o olfato, o tato e seus outros sabores. Não apenas cores, mas saliva e sal. Veludo em carne viva, nutritiva. Não apenas realidade virtual. Veludo humano, pano em carne viva. Menos realce, mais vida real. O povo sabe o que quer. Mas o povo também quer o que não sabe. O povo sabe o que quer. Mas o povo também quer o que não sabe. O que não sabe, o que não saberia. Porque morreria sem poder provar. Como provar a pilha com a ponta da língua. Receber o choque elétrico e saber. Poder matar a fome é pra quem come, é claro. Não apenas pra quem vê comer. Assim feito a criança pobre esfarrapada. Come feijoada que vê na TV. Essa criança quer o que não come. Quer o que não sabe, quer poder viver. Assim como viveu um Galileu, um Newton. E outros tantos muitos pais do amanhã. Esses que provam que a Terra é redonda. E a gravidade é a simples queda da maçã. Que dão ao povo os frutos da ciência. Sabores sem os quais a vida é vã. O povo sabe o que quer. Mas o povo também quer o que não sabe. O povo sabe o que quer. Mas o povo também quer o que não sabe",Papel Social,Negativo
sujeitoadjetivo,criança sorridente,Tropicália,Gal Costa,mpb,"Sobre a cabeça os aviões. Sob os meus pés, os caminhões. Aponta contra os chapadões, meu nariz. Eu organizo o movimento. Eu oriento o carnaval. Eu inauguro o monumento. No planalto central do país. Viva a bossa, sa, sa. Viva a palhoça, ça, ça, ça, ça. O monumento é de papel crepom e prata. Os olhos verdes da mulata. A cabeleira esconde atrás da verde mata. O luar do sertão. O monumento não tem porta. A entrada é uma rua antiga,. Estreita e torta. E no joelho uma criança sorridente,. Feia e morta,. Estende a mão. Viva a mata, ta, ta. Viva a mulata, ta, ta, ta, ta. No pátio interno há uma piscina. Com água azul de Amaralina. Coqueiro, brisa e fala nordestina. E faróis. Na mão direita tem uma roseira. Autenticando eterna primavera. E no jardim os urubus passeiam. A tarde inteira entre os girassóis. Viva Maria, ia, ia. Viva a Bahia, ia, ia, ia, ia. No pulso esquerdo o bang-bang. Em suas veias corre muito pouco sangue. Mas seu coração. Balança a um samba de tamborim. Emite acordes dissonantes. Pelos cinco mil alto-falantes. Senhoras e senhores. Ele pões os olhos grandes sobre mim. Viva Iracema, ma, ma. Viva Ipanema, ma, ma, ma, ma. Domingo é o fino-da-bossa. Segunda-feira está na fossa. Terça-feira vai à roça. Porém, o monumento. É bem moderno. Não disse nada do modelo. Do meu terno. Que tudo mais vá pro inferno, meu bem. Que tudo mais vá pro inferno, meu bem. Viva a banda, da, da. Carmen Miranda, da, da, da da",Emoção,Positivo
